<?xml version="1.0" encoding="UTF-8" ?>
<!-- 如果在xsd中不加xmlns 默认的命名空间则下面必须写xmlns -->
<student  xmlns="http://www.leesure.com"
        xmlns:xsi="http://www.w3.org/2001/XMLSchema-instance"
            xsi:schemaLocation="http://www.leesure.com student.xsd">
    adsad<firstName>lee</firstName>
    <lastName>sure</lastName>
    <email>arm125@qq.com</email>
    <mobile>13525232332</mobile>
    <gender>male</gender>
    <age>0</age>
    <weight lang="EN">10</weight>
</student>